{
  "$schema": "https://json-schema.org/draft/2020-12/schema",
  "$id": "https://local.paper-collage.dev/asset-request.schema.json",
  "title": "Paper Collage Provider Asset Request",
  "type": "object",
  "required": ["schemaVersion", "projectSlug", "assetId", "capability", "output"],
  "properties": {
    "$schema": {"type": "string"},
    "schemaVersion": {"const": 7},
    "projectSlug": {"type": "string", "pattern": "^[a-z0-9]+(?:-[a-z0-9]+)*$"},
    "assetId": {"type": "string", "pattern": "^[a-z0-9]+(?:-[a-z0-9]+)*$"},
    "capability": {"enum": ["text", "image", "voice"]},
    "output": {"type": "string", "minLength": 1},
    "prompt": {"type": "string"},
    "text": {"type": "string"},
    "voiceId": {"type": "string"},
    "model": {"type": "string"},
    "settings": {"type": "object"},
    "outputSurface": {
      "type": "object",
      "required": ["mode"],
      "properties": {
        "mode": {"enum": ["alpha", "chroma-key", "opaque", "layer-sheet", "seamless-strip-x"]},
        "keyColor": {"type": "string", "pattern": "^#[0-9a-fA-F]{6}$"},
        "tolerance": {"type": "integer", "minimum": 0, "maximum": 255},
        "keyPlane": {"$ref": "#/$defs/observedKeyPlane"},
        "minimumViewportSpan": {"type": "number", "minimum": 1}
      },
      "allOf": [
        {
          "if": {"properties": {"mode": {"const": "chroma-key"}}},
          "then": {"required": ["keyColor"]}
        },
        {
          "if": {"properties": {"mode": {"const": "seamless-strip-x"}}},
          "then": {"required": ["minimumViewportSpan"]}
        }
      ],
      "additionalProperties": false
    },
    "timingBinding": {
      "type": "object",
      "required": ["sceneId"],
      "properties": {
        "sceneId": {"type": "string", "minLength": 1},
        "minDurationSeconds": {"type": "number", "exclusiveMinimum": 0},
        "maxDurationSeconds": {"type": "number", "exclusiveMinimum": 0}
      },
      "anyOf": [
        {"required": ["minDurationSeconds"]},
        {"required": ["maxDurationSeconds"]}
      ],
      "additionalProperties": false
    },
    "compositionBinding": {
      "type": "object",
      "required": ["sceneId", "nodeId", "pattern", "outputRole", "canvas", "derivation"],
      "properties": {
        "sceneId": {"type": "string", "minLength": 1},
        "nodeId": {"type": "string", "minLength": 1},
        "pattern": {"enum": ["free", "supported-subject", "registered-environment", "registered-depth-stack", "looping-environment", "state-sequence"]},
        "registrationId": {"type": "string", "minLength": 1},
        "sourceMasterAssetId": {"type": "string", "minLength": 1},
        "outputRole": {"type": "string", "minLength": 1},
        "canvas": {
          "type": "object",
          "required": ["width", "height"],
          "properties": {
            "width": {"type": "integer", "minimum": 1},
            "height": {"type": "integer", "minimum": 1}
          },
          "additionalProperties": false
        },
        "derivation": {
          "type": "object",
          "required": ["method"],
          "properties": {
            "method": {"enum": ["provider-generation", "provider-edit", "alpha-extraction", "crop", "seamless-period-crop", "mask-application", "manual-import"]},
            "parentAssetId": {"type": "string", "minLength": 1}
          },
          "additionalProperties": false
        }
      },
      "allOf": [
        {
          "if": {"properties": {"pattern": {"enum": ["supported-subject", "registered-environment", "registered-depth-stack", "state-sequence"]}}},
          "then": {"required": ["registrationId", "sourceMasterAssetId"]}
        }
      ],
      "additionalProperties": false
    },
    "layerPackageBinding": {
      "type": "object",
      "required": ["sourcePackageId", "pattern", "motionCapability", "sourceStrategy", "registrationId", "sourceMasterAssetId", "canvas", "packageRole", "completeness", "memberAssetIds", "referenceAssetIds", "sheetLayout", "recoveryPolicy"],
      "properties": {
        "sourcePackageId": {"type": "string", "pattern": "^[a-z0-9]+(?:-[a-z0-9]+)*$"},
        "pattern": {"enum": ["supported-subject", "registered-depth-stack"]},
        "motionCapability": {"const": "bounded-relative"},
        "sourceStrategy": {"enum": ["registered-layer-sheet", "context-preserving-layer-edits"]},
        "registrationId": {"type": "string", "minLength": 1},
        "sourceMasterAssetId": {"type": "string", "minLength": 1},
        "canvas": {
          "type": "object",
          "required": ["width", "height"],
          "properties": {
            "width": {"type": "integer", "minimum": 1},
            "height": {"type": "integer", "minimum": 1}
          },
          "additionalProperties": false
        },
        "packageRole": {"enum": ["reference", "registered-sheet", "support-rear", "subject", "support-front"]},
        "completeness": {"enum": ["clean-plate", "full-silhouette", "full-overlay", null]},
        "memberAssetIds": {
          "type": "array",
          "minItems": 3,
          "maxItems": 3,
          "uniqueItems": true,
          "items": {"type": "string", "pattern": "^[a-z0-9]+(?:-[a-z0-9]+)*$"}
        },
        "referenceAssetIds": {
          "type": "array",
          "minItems": 1,
          "uniqueItems": true,
          "items": {"type": "string", "pattern": "^[a-z0-9]+(?:-[a-z0-9]+)*$"}
        },
        "sheetLayout": {
          "oneOf": [
            {"type": "null"},
            {
              "type": "object",
              "required": ["columns", "rows", "cells"],
              "properties": {
                "columns": {"const": 2},
                "rows": {"const": 2},
                "providerSource": {
                  "oneOf": [
                    {"type": "null"},
                    {
                      "type": "object",
                      "required": ["canvasMode", "minimumWidth", "minimumHeight", "cellExtraction"],
                      "properties": {
                        "canvasMode": {"const": "provider-native"},
                        "minimumWidth": {"type": "integer", "minimum": 2},
                        "minimumHeight": {"type": "integer", "minimum": 2},
                        "cellExtraction": {"const": "explicit-rects"}
                      },
                      "additionalProperties": false
                    }
                  ]
                },
                "cells": {
                  "type": "array",
                  "minItems": 4,
                  "maxItems": 4,
                  "items": {
                    "type": "object",
                    "required": ["packageRole", "row", "column", "outputSurface"],
                    "properties": {
                      "packageRole": {"enum": ["reference", "support-rear", "subject", "support-front"]},
                      "row": {"type": "integer", "minimum": 0, "maximum": 1},
                      "column": {"type": "integer", "minimum": 0, "maximum": 1},
                      "outputSurface": {
                        "type": "object",
                        "required": ["mode"],
                        "properties": {
                          "mode": {"enum": ["alpha", "chroma-key", "opaque"]},
                          "keyColor": {"type": "string", "pattern": "^#[0-9a-fA-F]{6}$"},
                          "tolerance": {"type": "integer", "minimum": 0, "maximum": 255},
                          "keyPlane": {"$ref": "#/$defs/observedKeyPlane"}
                        },
                        "allOf": [
                          {
                            "if": {"properties": {"mode": {"const": "chroma-key"}}},
                            "then": {"required": ["keyColor"]}
                          }
                        ],
                        "additionalProperties": false
                      }
                    },
                    "additionalProperties": false
                  }
                }
              },
              "additionalProperties": false
            }
          ]
        },
        "recoveryPolicy": {
          "type": "object",
          "required": ["completeSourceContext", "localDeterministicFixFirst", "isolatedMemberGeneration", "providerRepair", "fallback"],
          "properties": {
            "completeSourceContext": {"const": true},
            "localDeterministicFixFirst": {"const": true},
            "isolatedMemberGeneration": {"const": "forbidden"},
            "providerRepair": {"const": "masked-complete-source-edit"},
            "fallback": {"const": "full-source-regeneration"}
          },
          "additionalProperties": false
        }
      },
      "additionalProperties": false
    },
    "stateBinding": {
      "type": "object",
      "required": ["poseFamilyId", "stateId", "registrationId", "sourceMasterAssetId"],
      "properties": {
        "poseFamilyId": {"type": "string", "minLength": 1},
        "stateId": {"type": "string", "minLength": 1},
        "registrationId": {"type": "string", "minLength": 1},
        "sourceMasterAssetId": {"type": "string", "minLength": 1}
      },
      "additionalProperties": false
    },
    "stateSheetBinding": {
      "type": "object",
      "required": ["poseFamilyId", "registrationId", "sourceMasterAssetId", "layout", "states", "recoveryPolicy"],
      "properties": {
        "poseFamilyId": {"type": "string", "minLength": 1},
        "registrationId": {"type": "string", "minLength": 1},
        "sourceMasterAssetId": {"type": "string", "minLength": 1},
        "layout": {
          "type": "object",
          "required": ["columns", "rows"],
          "properties": {
            "columns": {"type": "integer", "minimum": 1},
            "rows": {"type": "integer", "minimum": 1}
          },
          "additionalProperties": false
        },
        "states": {
          "type": "array",
          "minItems": 2,
          "items": {
            "type": "object",
            "required": ["stateId", "row", "column"],
            "properties": {
              "stateId": {"type": "string", "minLength": 1},
              "row": {"type": "integer", "minimum": 0},
              "column": {"type": "integer", "minimum": 0}
            },
            "additionalProperties": false
          }
        },
        "recoveryPolicy": {
          "type": "object",
          "required": ["strategy", "localDeterministicFixFirst", "isolatedCellGeneration", "fallback"],
          "properties": {
            "strategy": {"const": "preserve-sheet-context"},
            "localDeterministicFixFirst": {"const": true},
            "isolatedCellGeneration": {"const": "forbidden"},
            "fallback": {"const": "full-sheet-regeneration"}
          },
          "additionalProperties": false
        }
      },
      "additionalProperties": false
    },
    "stateSheetRecoveryBinding": {
      "type": "object",
      "required": ["mode", "sourceSheetAssetId", "targetStateIds"],
      "properties": {
        "mode": {"enum": ["masked-sheet-edit", "full-sheet-regeneration"]},
        "sourceSheetAssetId": {"type": "string", "pattern": "^[a-z0-9]+(?:-[a-z0-9]+)*$"},
        "targetStateIds": {
          "type": "array",
          "minItems": 1,
          "uniqueItems": true,
          "items": {"type": "string", "minLength": 1}
        },
        "maskAssetId": {"type": "string", "pattern": "^[a-z0-9]+(?:-[a-z0-9]+)*$"},
        "maskPolarity": {"const": "white-is-editable"}
      },
      "allOf": [
        {
          "if": {"required": ["mode"], "properties": {"mode": {"const": "masked-sheet-edit"}}},
          "then": {"required": ["maskAssetId", "maskPolarity"]}
        }
      ],
      "additionalProperties": false
    },
    "semanticBinding": {
      "type": "object",
      "required": ["riskClass", "contractIds"],
      "properties": {
        "riskClass": {"enum": ["decorative", "identity-critical", "topology-critical", "mechanism-critical", "diagram-critical"]},
        "contractIds": {
          "type": "array",
          "uniqueItems": true,
          "items": {"type": "string", "pattern": "^[a-z0-9]+(?:-[a-z0-9]+)*$"}
        },
        "generationFamily": {
          "type": "object",
          "required": ["familyId", "memberIds", "referenceAssetIds"],
          "properties": {
            "familyId": {"type": "string", "pattern": "^[a-z0-9]+(?:-[a-z0-9]+)*$"},
            "memberIds": {"type": "array", "minItems": 1, "uniqueItems": true, "items": {"type": "string", "pattern": "^[a-z0-9]+(?:-[a-z0-9]+)*$"}},
            "referenceAssetIds": {"type": "array", "uniqueItems": true, "items": {"type": "string", "pattern": "^[a-z0-9]+(?:-[a-z0-9]+)*$"}}
          },
          "additionalProperties": false
        }
      },
      "allOf": [
        {
          "if": {"properties": {"riskClass": {"const": "decorative"}}},
          "then": {"properties": {"contractIds": {"maxItems": 0}}}
        },
        {
          "if": {"properties": {"riskClass": {"const": "identity-critical"}}},
          "then": {"required": ["generationFamily"], "properties": {"contractIds": {"minItems": 1}}}
        },
        {
          "if": {"properties": {"riskClass": {"enum": ["topology-critical", "mechanism-critical", "diagram-critical"]}}},
          "then": {"properties": {"contractIds": {"minItems": 1}}}
        }
      ],
      "additionalProperties": false
    },
    "quality": {
      "type": "object",
      "properties": {
        "kind": {"enum": ["background", "environment", "character", "prop", "decorative", "character-sheet", "style-sample", "mechanism", "diagram", "image"]},
        "requiredChecks": {
          "type": "array",
          "minItems": 1,
          "uniqueItems": true,
          "items": {"enum": ["no-text", "no-watermark", "no-people", "safe-area-clear", "style-consistent", "subject-complete", "identity-consistent", "identity-distinct-within-frame", "identity-family-consistent", "cross-scene-identity-continuity", "cell-separation", "untargeted-cells-unchanged", "background-uniform", "edge-clean", "silhouette-fidelity", "negative-space-clean", "background-leak-free", "mechanism-complete", "load-path-readable", "physical-plausibility", "reference-conformant", "diagram-edge-clean", "small-text-legible", "no-procedural-noise-on-semantic-lines"]}
        }
      },
      "additionalProperties": false
    }
  },
  "additionalProperties": false,
  "allOf": [
    {"if": {"properties": {"capability": {"const": "text"}}}, "then": {"required": ["prompt"]}},
    {"if": {"properties": {"capability": {"const": "image"}}}, "then": {"required": ["prompt", "compositionBinding", "outputSurface"]}},
    {"if": {"properties": {"capability": {"const": "image"}}}, "then": {"required": ["semanticBinding"]}},
    {"if": {"properties": {"compositionBinding": {"properties": {"pattern": {"const": "state-sequence"}}}}}, "then": {"oneOf": [{"required": ["stateBinding"]}, {"required": ["stateSheetBinding"]}]}},
    {"if": {"properties": {"compositionBinding": {"properties": {"pattern": {"const": "registered-depth-stack"}}}}}, "then": {"required": ["layerPackageBinding"]}},
    {"if": {"required": ["layerPackageBinding"]}, "then": {"properties": {"capability": {"const": "image"}}}},
    {"if": {"required": ["stateSheetRecoveryBinding"]}, "then": {"required": ["stateSheetBinding", "quality", "compositionBinding"], "properties": {"compositionBinding": {"properties": {"pattern": {"const": "state-sequence"}}}}}},
    {"if": {"properties": {"capability": {"const": "voice"}}}, "then": {"required": ["text"]}},
    {"if": {"required": ["timingBinding"]}, "then": {"properties": {"capability": {"const": "voice"}}}}
  ],
  "$defs": {
    "observedKeyPlane": {
      "type": "object",
      "required": ["mode", "policyId"],
      "properties": {
        "mode": {"const": "provider-native-observed"},
        "policyId": {"const": "flat-v1"}
      },
      "additionalProperties": false
    }
  }
}
